Sheet: Sheet1
A1: WPM | B1: dit length | C1: rounded dit length | D1: real WPM | E1: error
A2: 10 | B2: of:=6000/(5*[.A2]) -> 120 | C2: of:=ROUND([.B2]*([.$B$35]/1000); 0)/([.$B$35]/1000) -> 120 | D2: of:=6000/(5*[.C2]) -> 10 | E2: of:=ABS([.A2]-[.D2]) -> 0
A3: of:=[.A2]+1 -> 11 | B3: of:=6000/(5*[.A3]) -> 109.090909090909 | C3: of:=ROUND([.B3]*([.$B$35]/1000); 0)/([.$B$35]/1000) -> 109 | D3: of:=6000/(5*[.C3]) -> 11.0091743119266 | E3: of:=ABS([.A3]-[.D3]) -> 0.00917431192660523
A4: of:=[.A3]+1 -> 12 | B4: of:=6000/(5*[.A4]) -> 100 | C4: of:=ROUND([.B4]*([.$B$35]/1000); 0)/([.$B$35]/1000) -> 100 | D4: of:=6000/(5*[.C4]) -> 12 | E4: of:=ABS([.A4]-[.D4]) -> 0
A5: of:=[.A4]+1 -> 13 | B5: of:=6000/(5*[.A5]) -> 92.3076923076923 | C5: of:=ROUND([.B5]*([.$B$35]/1000); 0)/([.$B$35]/1000) -> 92.25 | D5: of:=6000/(5*[.C5]) -> 13.0081300813008 | E5: of:=ABS([.A5]-[.D5]) -> 0.00813008130081272
A6: of:=[.A5]+1 -> 14 | B6: of:=6000/(5*[.A6]) -> 85.7142857142857 | C6: of:=ROUND([.B6]*([.$B$35]/1000); 0)/([.$B$35]/1000) -> 85.75 | D6: of:=6000/(5*[.C6]) -> 13.9941690962099 | E6: of:=ABS([.A6]-[.D6]) -> 0.00583090379008766
A7: of:=[.A6]+1 -> 15 | B7: of:=6000/(5*[.A7]) -> 80 | C7: of:=ROUND([.B7]*([.$B$35]/1000); 0)/([.$B$35]/1000) -> 80 | D7: of:=6000/(5*[.C7]) -> 15 | E7: of:=ABS([.A7]-[.D7]) -> 0
A8: of:=[.A7]+1 -> 16 | B8: of:=6000/(5*[.A8]) -> 75 | C8: of:=ROUND([.B8]*([.$B$35]/1000); 0)/([.$B$35]/1000) -> 75 | D8: of:=6000/(5*[.C8]) -> 16 | E8: of:=ABS([.A8]-[.D8]) -> 0
A9: of:=[.A8]+1 -> 17 | B9: of:=6000/(5*[.A9]) -> 70.5882352941177 | C9: of:=ROUND([.B9]*([.$B$35]/1000); 0)/([.$B$35]/1000) -> 70.5 | D9: of:=6000/(5*[.C9]) -> 17.0212765957447 | E9: of:=ABS([.A9]-[.D9]) -> 0.0212765957446805
A10: of:=[.A9]+1 -> 18 | B10: of:=6000/(5*[.A10]) -> 66.6666666666667 | C10: of:=ROUND([.B10]*([.$B$35]/1000); 0)/([.$B$35]/1000) -> 66.75 | D10: of:=6000/(5*[.C10]) -> 17.9775280898876 | E10: of:=ABS([.A10]-[.D10]) -> 0.0224719101123583
A11: of:=[.A10]+1 -> 19 | B11: of:=6000/(5*[.A11]) -> 63.1578947368421 | C11: of:=ROUND([.B11]*([.$B$35]/1000); 0)/([.$B$35]/1000) -> 63.25 | D11: of:=6000/(5*[.C11]) -> 18.9723320158103 | E11: of:=ABS([.A11]-[.D11]) -> 0.0276679841897227
A12: of:=[.A11]+1 -> 20 | B12: of:=6000/(5*[.A12]) -> 60 | C12: of:=ROUND([.B12]*([.$B$35]/1000); 0)/([.$B$35]/1000) -> 60 | D12: of:=6000/(5*[.C12]) -> 20 | E12: of:=ABS([.A12]-[.D12]) -> 0
A13: of:=[.A12]+1 -> 21 | B13: of:=6000/(5*[.A13]) -> 57.1428571428571 | C13: of:=ROUND([.B13]*([.$B$35]/1000); 0)/([.$B$35]/1000) -> 57.25 | D13: of:=6000/(5*[.C13]) -> 20.9606986899563 | E13: of:=ABS([.A13]-[.D13]) -> 0.039301310043669
A14: of:=[.A13]+1 -> 22 | B14: of:=6000/(5*[.A14]) -> 54.5454545454546 | C14: of:=ROUND([.B14]*([.$B$35]/1000); 0)/([.$B$35]/1000) -> 54.5 | D14: of:=6000/(5*[.C14]) -> 22.0183486238532 | E14: of:=ABS([.A14]-[.D14]) -> 0.0183486238532105
A15: of:=[.A14]+1 -> 23 | B15: of:=6000/(5*[.A15]) -> 52.1739130434783 | C15: of:=ROUND([.B15]*([.$B$35]/1000); 0)/([.$B$35]/1000) -> 52.25 | D15: of:=6000/(5*[.C15]) -> 22.9665071770335 | E15: of:=ABS([.A15]-[.D15]) -> 0.0334928229665081
A16: of:=[.A15]+1 -> 24 | B16: of:=6000/(5*[.A16]) -> 50 | C16: of:=ROUND([.B16]*([.$B$35]/1000); 0)/([.$B$35]/1000) -> 50 | D16: of:=6000/(5*[.C16]) -> 24 | E16: of:=ABS([.A16]-[.D16]) -> 0
A17: of:=[.A16]+1 -> 25 | B17: of:=6000/(5*[.A17]) -> 48 | C17: of:=ROUND([.B17]*([.$B$35]/1000); 0)/([.$B$35]/1000) -> 48 | D17: of:=6000/(5*[.C17]) -> 25 | E17: of:=ABS([.A17]-[.D17]) -> 0
A18: of:=[.A17]+1 -> 26 | B18: of:=6000/(5*[.A18]) -> 46.1538461538462 | C18: of:=ROUND([.B18]*([.$B$35]/1000); 0)/([.$B$35]/1000) -> 46.25 | D18: of:=6000/(5*[.C18]) -> 25.9459459459459 | E18: of:=ABS([.A18]-[.D18]) -> 0.0540540540540526
A19: of:=[.A18]+1 -> 27 | B19: of:=6000/(5*[.A19]) -> 44.4444444444444 | C19: of:=ROUND([.B19]*([.$B$35]/1000); 0)/([.$B$35]/1000) -> 44.5 | D19: of:=6000/(5*[.C19]) -> 26.9662921348315 | E19: of:=ABS([.A19]-[.D19]) -> 0.033707865168541
A20: of:=[.A19]+1 -> 28 | B20: of:=6000/(5*[.A20]) -> 42.8571428571429 | C20: of:=ROUND([.B20]*([.$B$35]/1000); 0)/([.$B$35]/1000) -> 42.75 | D20: of:=6000/(5*[.C20]) -> 28.0701754385965 | E20: of:=ABS([.A20]-[.D20]) -> 0.0701754385964897
A21: of:=[.A20]+1 -> 29 | B21: of:=6000/(5*[.A21]) -> 41.3793103448276 | C21: of:=ROUND([.B21]*([.$B$35]/1000); 0)/([.$B$35]/1000) -> 41.5 | D21: of:=6000/(5*[.C21]) -> 28.9156626506024 | E21: of:=ABS([.A21]-[.D21]) -> 0.0843373493975896
A22: of:=[.A21]+1 -> 30 | B22: of:=6000/(5*[.A22]) -> 40 | C22: of:=ROUND([.B22]*([.$B$35]/1000); 0)/([.$B$35]/1000) -> 40 | D22: of:=6000/(5*[.C22]) -> 30 | E22: of:=ABS([.A22]-[.D22]) -> 0
A23: of:=[.A22]+1 -> 31 | B23: of:=6000/(5*[.A23]) -> 38.7096774193548 | C23: of:=ROUND([.B23]*([.$B$35]/1000); 0)/([.$B$35]/1000) -> 38.75 | D23: of:=6000/(5*[.C23]) -> 30.9677419354839 | E23: of:=ABS([.A23]-[.D23]) -> 0.0322580645161281
A24: of:=[.A23]+1 -> 32 | B24: of:=6000/(5*[.A24]) -> 37.5 | C24: of:=ROUND([.B24]*([.$B$35]/1000); 0)/([.$B$35]/1000) -> 37.5 | D24: of:=6000/(5*[.C24]) -> 32 | E24: of:=ABS([.A24]-[.D24]) -> 0
A25: of:=[.A24]+1 -> 33 | B25: of:=6000/(5*[.A25]) -> 36.3636363636364 | C25: of:=ROUND([.B25]*([.$B$35]/1000); 0)/([.$B$35]/1000) -> 36.25 | D25: of:=6000/(5*[.C25]) -> 33.1034482758621 | E25: of:=ABS([.A25]-[.D25]) -> 0.103448275862071
A26: of:=[.A25]+1 -> 34 | B26: of:=6000/(5*[.A26]) -> 35.2941176470588 | C26: of:=ROUND([.B26]*([.$B$35]/1000); 0)/([.$B$35]/1000) -> 35.25 | D26: of:=6000/(5*[.C26]) -> 34.0425531914894 | E26: of:=ABS([.A26]-[.D26]) -> 0.0425531914893611
A27: of:=[.A26]+1 -> 35 | B27: of:=6000/(5*[.A27]) -> 34.2857142857143 | C27: of:=ROUND([.B27]*([.$B$35]/1000); 0)/([.$B$35]/1000) -> 34.25 | D27: of:=6000/(5*[.C27]) -> 35.036496350365 | E27: of:=ABS([.A27]-[.D27]) -> 0.0364963503649633
A28: of:=[.A27]+1 -> 36 | B28: of:=6000/(5*[.A28]) -> 33.3333333333333 | C28: of:=ROUND([.B28]*([.$B$35]/1000); 0)/([.$B$35]/1000) -> 33.25 | D28: of:=6000/(5*[.C28]) -> 36.0902255639098 | E28: of:=ABS([.A28]-[.D28]) -> 0.090225563909776
A29: of:=[.A28]+1 -> 37 | B29: of:=6000/(5*[.A29]) -> 32.4324324324324 | C29: of:=ROUND([.B29]*([.$B$35]/1000); 0)/([.$B$35]/1000) -> 32.5 | D29: of:=6000/(5*[.C29]) -> 36.9230769230769 | E29: of:=ABS([.A29]-[.D29]) -> 0.0769230769230802
A30: of:=[.A29]+1 -> 38 | B30: of:=6000/(5*[.A30]) -> 31.5789473684211 | C30: of:=ROUND([.B30]*([.$B$35]/1000); 0)/([.$B$35]/1000) -> 31.5 | D30: of:=6000/(5*[.C30]) -> 38.0952380952381 | E30: of:=ABS([.A30]-[.D30]) -> 0.0952380952380949
A31: of:=[.A30]+1 -> 39 | B31: of:=6000/(5*[.A31]) -> 30.7692307692308 | C31: of:=ROUND([.B31]*([.$B$35]/1000); 0)/([.$B$35]/1000) -> 30.75 | D31: of:=6000/(5*[.C31]) -> 39.0243902439024 | E31: of:=ABS([.A31]-[.D31]) -> 0.0243902439024382
A32: of:=[.A31]+1 -> 40 | B32: of:=6000/(5*[.A32]) -> 30 | C32: of:=ROUND([.B32]*([.$B$35]/1000); 0)/([.$B$35]/1000) -> 30 | D32: of:=6000/(5*[.C32]) -> 40 | E32: of:=ABS([.A32]-[.D32]) -> 0
A35: IRQ | B35: 4000 | D35: max error | E35: of:=MAX([.E2:.E32]) -> 0.103448275862071
A36: cycle time | B36: of:=1000000/[.B35] -> 250